{
  "version":"1.0",
  "domain":"example.haven.local",
  "identity_public_key":"m2J3MyPvQaEYNIJBlOVRZNMl65zcwQ3dp9EK3k-9j20",
  "created_at":"2026-02-26T08:00:00Z",
  "expires_at":"2026-02-26T08:05:00Z",
  "nonce":"8PDw8PDw8PDw8PDw8PDw8PDw8PDw8PDw8PDw8PDw8PA",
  "purpose_interest":{"purpose":"bootstrap.join_scaffold","interests":["haven.core.bootstrap","haven.core.bridge"]},
  "signature":{"alg":"Ed25519","sig":"weK57_5rtlom2ZaS_yECjayq_LA3yiUoglRPKmxfD6fCtFZOzN38thTqIPzEPr9V20TtIWnsxiwbm9cZCYRLCw"}
}
